{
  "created_at": "2026-05-21T20:58:26.005423Z",
  "ranked_findings": [
    {
      "blast_radius": "service",
      "classification": "duplicate_replay",
      "failure_id": "FC-0001",
      "fix_complexity": "small",
      "frequency": 1,
      "lane_agreement": 1,
      "lanes": [
        "edge_case"
      ],
      "rank": 1,
      "ready_for_gate": true,
      "receipts": [
        "FHR-f87c499749"
      ],
      "recommended_fix": "enforce idempotency on the request key (existing-result reuse).",
      "repro_command": "./scripts/replay_failure.sh sandbox/receipts/FHR-f87c499749.json",
      "reproducibility": "reproducible",
      "score": 96,
      "severity": "high"
    },
    {
      "blast_radius": "unknown",
      "classification": "no_failure_observed",
      "failure_id": "FC-0002",
      "fix_complexity": "trivial",
      "frequency": 1,
      "lane_agreement": 1,
      "lanes": [
        "edge_case"
      ],
      "rank": 2,
      "ready_for_gate": false,
      "receipts": [
        "FHR-a32fbd29aa"
      ],
      "recommended_fix": "no fix needed; case may be promoted into the regression gate.",
      "repro_command": "./scripts/replay_failure.sh sandbox/receipts/FHR-a32fbd29aa.json",
      "reproducibility": "reproducible",
      "score": 33,
      "severity": "info"
    },
    {
      "blast_radius": "unknown",
      "classification": "no_failure_observed",
      "failure_id": "FC-0003",
      "fix_complexity": "trivial",
      "frequency": 1,
      "lane_agreement": 1,
      "lanes": [
        "edge_case"
      ],
      "rank": 3,
      "ready_for_gate": false,
      "receipts": [
        "FHR-8616211567"
      ],
      "recommended_fix": "no fix needed; case may be promoted into the regression gate.",
      "repro_command": "./scripts/replay_failure.sh sandbox/receipts/FHR-8616211567.json",
      "reproducibility": "reproducible",
      "score": 33,
      "severity": "info"
    },
    {
      "blast_radius": "unknown",
      "classification": "no_failure_observed",
      "failure_id": "FC-0004",
      "fix_complexity": "trivial",
      "frequency": 1,
      "lane_agreement": 1,
      "lanes": [
        "edge_case"
      ],
      "rank": 4,
      "ready_for_gate": false,
      "receipts": [
        "FHR-eccc318bcc"
      ],
      "recommended_fix": "no fix needed; case may be promoted into the regression gate.",
      "repro_command": "./scripts/replay_failure.sh sandbox/receipts/FHR-eccc318bcc.json",
      "reproducibility": "reproducible",
      "score": 33,
      "severity": "info"
    },
    {
      "blast_radius": "unknown",
      "classification": "no_failure_observed",
      "failure_id": "FC-0005",
      "fix_complexity": "trivial",
      "frequency": 1,
      "lane_agreement": 1,
      "lanes": [
        "edge_case"
      ],
      "rank": 5,
      "ready_for_gate": false,
      "receipts": [
        "FHR-47892f1946"
      ],
      "recommended_fix": "no fix needed; case may be promoted into the regression gate.",
      "repro_command": "./scripts/replay_failure.sh sandbox/receipts/FHR-47892f1946.json",
      "reproducibility": "reproducible",
      "score": 33,
      "severity": "info"
    },
    {
      "blast_radius": "unknown",
      "classification": "no_failure_observed",
      "failure_id": "FC-0006",
      "fix_complexity": "trivial",
      "frequency": 1,
      "lane_agreement": 1,
      "lanes": [
        "edge_case"
      ],
      "rank": 6,
      "ready_for_gate": false,
      "receipts": [
        "FHR-5fd4475055"
      ],
      "recommended_fix": "no fix needed; case may be promoted into the regression gate.",
      "repro_command": "./scripts/replay_failure.sh sandbox/receipts/FHR-5fd4475055.json",
      "reproducibility": "reproducible",
      "score": 33,
      "severity": "info"
    }
  ],
  "receipts_total": 6,
  "report_id": "HR-0c0c5b1b60",
  "reproducible_total": 6,
  "sandbox_run_id": "SR-364c6dc753",
  "schema_version": "HardeningReport.v1",
  "summary": "6 receipts produced, 6 reproducible, top finding: enforce idempotency on the request key (existing-result reuse).",
  "target_repo": "example-repo"
}