{
  "created_at": "2026-05-20T17:33:10.642289Z",
  "ranked_findings": [
    {
      "blast_radius": "service",
      "classification": "duplicate_replay",
      "failure_id": "FC-0001",
      "fix_complexity": "small",
      "frequency": 1,
      "lane_agreement": 1,
      "lanes": [
        "edge_case"
      ],
      "rank": 1,
      "ready_for_gate": true,
      "receipts": [
        "FHR-f5a441a54a"
      ],
      "recommended_fix": "enforce idempotency on the request key (existing-result reuse).",
      "repro_command": "./scripts/replay_failure.sh sandbox/receipts/FHR-f5a441a54a.json",
      "reproducibility": "reproducible",
      "score": 96,
      "severity": "high"
    },
    {
      "blast_radius": "unknown",
      "classification": "no_failure_observed",
      "failure_id": "FC-0002",
      "fix_complexity": "trivial",
      "frequency": 1,
      "lane_agreement": 1,
      "lanes": [
        "edge_case"
      ],
      "rank": 2,
      "ready_for_gate": false,
      "receipts": [
        "FHR-7512f98828"
      ],
      "recommended_fix": "no fix needed; case may be promoted into the regression gate.",
      "repro_command": "./scripts/replay_failure.sh sandbox/receipts/FHR-7512f98828.json",
      "reproducibility": "reproducible",
      "score": 33,
      "severity": "info"
    },
    {
      "blast_radius": "unknown",
      "classification": "no_failure_observed",
      "failure_id": "FC-0003",
      "fix_complexity": "trivial",
      "frequency": 1,
      "lane_agreement": 1,
      "lanes": [
        "edge_case"
      ],
      "rank": 3,
      "ready_for_gate": false,
      "receipts": [
        "FHR-72a4e1f255"
      ],
      "recommended_fix": "no fix needed; case may be promoted into the regression gate.",
      "repro_command": "./scripts/replay_failure.sh sandbox/receipts/FHR-72a4e1f255.json",
      "reproducibility": "reproducible",
      "score": 33,
      "severity": "info"
    },
    {
      "blast_radius": "unknown",
      "classification": "no_failure_observed",
      "failure_id": "FC-0004",
      "fix_complexity": "trivial",
      "frequency": 1,
      "lane_agreement": 1,
      "lanes": [
        "edge_case"
      ],
      "rank": 4,
      "ready_for_gate": false,
      "receipts": [
        "FHR-757b6c068d"
      ],
      "recommended_fix": "no fix needed; case may be promoted into the regression gate.",
      "repro_command": "./scripts/replay_failure.sh sandbox/receipts/FHR-757b6c068d.json",
      "reproducibility": "reproducible",
      "score": 33,
      "severity": "info"
    },
    {
      "blast_radius": "unknown",
      "classification": "no_failure_observed",
      "failure_id": "FC-0005",
      "fix_complexity": "trivial",
      "frequency": 1,
      "lane_agreement": 1,
      "lanes": [
        "edge_case"
      ],
      "rank": 5,
      "ready_for_gate": false,
      "receipts": [
        "FHR-cd5493222c"
      ],
      "recommended_fix": "no fix needed; case may be promoted into the regression gate.",
      "repro_command": "./scripts/replay_failure.sh sandbox/receipts/FHR-cd5493222c.json",
      "reproducibility": "reproducible",
      "score": 33,
      "severity": "info"
    },
    {
      "blast_radius": "unknown",
      "classification": "no_failure_observed",
      "failure_id": "FC-0006",
      "fix_complexity": "trivial",
      "frequency": 1,
      "lane_agreement": 1,
      "lanes": [
        "edge_case"
      ],
      "rank": 6,
      "ready_for_gate": false,
      "receipts": [
        "FHR-77c2f09406"
      ],
      "recommended_fix": "no fix needed; case may be promoted into the regression gate.",
      "repro_command": "./scripts/replay_failure.sh sandbox/receipts/FHR-77c2f09406.json",
      "reproducibility": "reproducible",
      "score": 33,
      "severity": "info"
    }
  ],
  "receipts_total": 6,
  "report_id": "HR-0fae3e254c",
  "reproducible_total": 6,
  "sandbox_run_id": "SR-03b9c9ad73",
  "schema_version": "HardeningReport.v1",
  "summary": "6 receipts produced, 6 reproducible, top finding: enforce idempotency on the request key (existing-result reuse).",
  "target_repo": "example-repo"
}