{
  "created_at": "2026-05-21T20:58:25.124195Z",
  "ranked_findings": [
    {
      "blast_radius": "service",
      "classification": "duplicate_replay",
      "failure_id": "FC-0001",
      "fix_complexity": "small",
      "frequency": 1,
      "lane_agreement": 1,
      "lanes": [
        "edge_case"
      ],
      "rank": 1,
      "ready_for_gate": true,
      "receipts": [
        "FHR-b1aca560cd"
      ],
      "recommended_fix": "enforce idempotency on the request key (existing-result reuse).",
      "repro_command": "./scripts/replay_failure.sh sandbox/receipts/FHR-b1aca560cd.json --target-source /tmp/pytest-of-charlie/pytest-11/test_cli_runs_external_target_0/example-repo --adapter fixtures/valid/TargetAdapter.v1.valid.json",
      "reproducibility": "reproducible",
      "score": 96,
      "severity": "high"
    },
    {
      "blast_radius": "unknown",
      "classification": "no_failure_observed",
      "failure_id": "FC-0002",
      "fix_complexity": "trivial",
      "frequency": 1,
      "lane_agreement": 1,
      "lanes": [
        "edge_case"
      ],
      "rank": 2,
      "ready_for_gate": false,
      "receipts": [
        "FHR-0a349b3586"
      ],
      "recommended_fix": "no fix needed; case may be promoted into the regression gate.",
      "repro_command": "./scripts/replay_failure.sh sandbox/receipts/FHR-0a349b3586.json --target-source /tmp/pytest-of-charlie/pytest-11/test_cli_runs_external_target_0/example-repo --adapter fixtures/valid/TargetAdapter.v1.valid.json",
      "reproducibility": "reproducible",
      "score": 33,
      "severity": "info"
    },
    {
      "blast_radius": "unknown",
      "classification": "no_failure_observed",
      "failure_id": "FC-0003",
      "fix_complexity": "trivial",
      "frequency": 1,
      "lane_agreement": 1,
      "lanes": [
        "edge_case"
      ],
      "rank": 3,
      "ready_for_gate": false,
      "receipts": [
        "FHR-03aec0bdb7"
      ],
      "recommended_fix": "no fix needed; case may be promoted into the regression gate.",
      "repro_command": "./scripts/replay_failure.sh sandbox/receipts/FHR-03aec0bdb7.json --target-source /tmp/pytest-of-charlie/pytest-11/test_cli_runs_external_target_0/example-repo --adapter fixtures/valid/TargetAdapter.v1.valid.json",
      "reproducibility": "reproducible",
      "score": 33,
      "severity": "info"
    },
    {
      "blast_radius": "unknown",
      "classification": "no_failure_observed",
      "failure_id": "FC-0004",
      "fix_complexity": "trivial",
      "frequency": 1,
      "lane_agreement": 1,
      "lanes": [
        "edge_case"
      ],
      "rank": 4,
      "ready_for_gate": false,
      "receipts": [
        "FHR-a1f2506237"
      ],
      "recommended_fix": "no fix needed; case may be promoted into the regression gate.",
      "repro_command": "./scripts/replay_failure.sh sandbox/receipts/FHR-a1f2506237.json --target-source /tmp/pytest-of-charlie/pytest-11/test_cli_runs_external_target_0/example-repo --adapter fixtures/valid/TargetAdapter.v1.valid.json",
      "reproducibility": "reproducible",
      "score": 33,
      "severity": "info"
    },
    {
      "blast_radius": "unknown",
      "classification": "no_failure_observed",
      "failure_id": "FC-0005",
      "fix_complexity": "trivial",
      "frequency": 1,
      "lane_agreement": 1,
      "lanes": [
        "edge_case"
      ],
      "rank": 5,
      "ready_for_gate": false,
      "receipts": [
        "FHR-7503640851"
      ],
      "recommended_fix": "no fix needed; case may be promoted into the regression gate.",
      "repro_command": "./scripts/replay_failure.sh sandbox/receipts/FHR-7503640851.json --target-source /tmp/pytest-of-charlie/pytest-11/test_cli_runs_external_target_0/example-repo --adapter fixtures/valid/TargetAdapter.v1.valid.json",
      "reproducibility": "reproducible",
      "score": 33,
      "severity": "info"
    },
    {
      "blast_radius": "unknown",
      "classification": "no_failure_observed",
      "failure_id": "FC-0006",
      "fix_complexity": "trivial",
      "frequency": 1,
      "lane_agreement": 1,
      "lanes": [
        "edge_case"
      ],
      "rank": 6,
      "ready_for_gate": false,
      "receipts": [
        "FHR-abde2ddb13"
      ],
      "recommended_fix": "no fix needed; case may be promoted into the regression gate.",
      "repro_command": "./scripts/replay_failure.sh sandbox/receipts/FHR-abde2ddb13.json --target-source /tmp/pytest-of-charlie/pytest-11/test_cli_runs_external_target_0/example-repo --adapter fixtures/valid/TargetAdapter.v1.valid.json",
      "reproducibility": "reproducible",
      "score": 33,
      "severity": "info"
    }
  ],
  "receipts_total": 6,
  "report_id": "HR-66723dd6f3",
  "reproducible_total": 6,
  "sandbox_run_id": "SR-external-source",
  "schema_version": "HardeningReport.v1",
  "summary": "6 receipts produced, 6 reproducible, top finding: enforce idempotency on the request key (existing-result reuse).",
  "target_repo": "example-repo"
}