{
  "created_at": "2026-05-05T01:50:07.264995Z",
  "ranked_findings": [
    {
      "blast_radius": "service",
      "classification": "duplicate_replay",
      "failure_id": "FC-0001",
      "fix_complexity": "small",
      "frequency": 1,
      "rank": 1,
      "ready_for_gate": true,
      "receipts": [
        "FHR-e458eed4e2"
      ],
      "recommended_fix": "enforce idempotency on the request key (existing-result reuse).",
      "repro_command": "./scripts/replay_failure.sh sandbox/receipts/FHR-e458eed4e2.json",
      "reproducibility": "reproducible",
      "score": 96,
      "severity": "high"
    },
    {
      "blast_radius": "unknown",
      "classification": "no_failure_observed",
      "failure_id": "FC-0002",
      "fix_complexity": "trivial",
      "frequency": 1,
      "rank": 2,
      "ready_for_gate": false,
      "receipts": [
        "FHR-a14c52b935"
      ],
      "recommended_fix": "no fix needed; case may be promoted into the regression gate.",
      "repro_command": "./scripts/replay_failure.sh sandbox/receipts/FHR-a14c52b935.json",
      "reproducibility": "reproducible",
      "score": 33,
      "severity": "info"
    },
    {
      "blast_radius": "unknown",
      "classification": "no_failure_observed",
      "failure_id": "FC-0003",
      "fix_complexity": "trivial",
      "frequency": 1,
      "rank": 3,
      "ready_for_gate": false,
      "receipts": [
        "FHR-07f6c8b4b6"
      ],
      "recommended_fix": "no fix needed; case may be promoted into the regression gate.",
      "repro_command": "./scripts/replay_failure.sh sandbox/receipts/FHR-07f6c8b4b6.json",
      "reproducibility": "reproducible",
      "score": 33,
      "severity": "info"
    },
    {
      "blast_radius": "unknown",
      "classification": "no_failure_observed",
      "failure_id": "FC-0004",
      "fix_complexity": "trivial",
      "frequency": 1,
      "rank": 4,
      "ready_for_gate": false,
      "receipts": [
        "FHR-d587efb83e"
      ],
      "recommended_fix": "no fix needed; case may be promoted into the regression gate.",
      "repro_command": "./scripts/replay_failure.sh sandbox/receipts/FHR-d587efb83e.json",
      "reproducibility": "reproducible",
      "score": 33,
      "severity": "info"
    },
    {
      "blast_radius": "unknown",
      "classification": "no_failure_observed",
      "failure_id": "FC-0005",
      "fix_complexity": "trivial",
      "frequency": 1,
      "rank": 5,
      "ready_for_gate": false,
      "receipts": [
        "FHR-85e8368902"
      ],
      "recommended_fix": "no fix needed; case may be promoted into the regression gate.",
      "repro_command": "./scripts/replay_failure.sh sandbox/receipts/FHR-85e8368902.json",
      "reproducibility": "reproducible",
      "score": 33,
      "severity": "info"
    },
    {
      "blast_radius": "unknown",
      "classification": "no_failure_observed",
      "failure_id": "FC-0006",
      "fix_complexity": "trivial",
      "frequency": 1,
      "rank": 6,
      "ready_for_gate": false,
      "receipts": [
        "FHR-4e9ef64d27"
      ],
      "recommended_fix": "no fix needed; case may be promoted into the regression gate.",
      "repro_command": "./scripts/replay_failure.sh sandbox/receipts/FHR-4e9ef64d27.json",
      "reproducibility": "reproducible",
      "score": 33,
      "severity": "info"
    }
  ],
  "receipts_total": 6,
  "report_id": "HR-30429e3704",
  "reproducible_total": 6,
  "sandbox_run_id": "SR-a63546096e",
  "schema_version": "HardeningReport.v1",
  "summary": "6 receipts produced, 6 reproducible, top finding: enforce idempotency on the request key (existing-result reuse).",
  "target_repo": "example-repo"
}